{
  "schema_version": 1,
  "skill_id": "architectural-assembly-reveal",
  "status": "published",
  "validator_version": "1.1.0",
  "approved_by": "user",
  "validated_at": "2026-08-15T11:19:44.300661+00:00",
  "sources": [
    {
      "name": "建筑特写至全貌拆解组装动画视频提示词生成 Skill.md",
      "sha256": "04a33d9ce95081a6923bf5ec3f3c15fbebf223e31ad04f8342b2562635948bbd"
    }
  ],
  "package_sha256": "e88be3aa2406ea08e634e48a74f73792fc5bec0c236882a502d5a3b75ff4013d"
}
